" -----Welcome to Employee Payroll Service program on MySQL DB-----"
-------------------------------------------------------------------------
UC1-> Create a database Payroll_service and Show and Used that data base
-------------------------------------------------------------------------

mysql> create database payroll_service;
Query OK, 1 row affected (0.34 sec)

mysql> show databases;
+----------------------+
| Database             |
+----------------------+
| address_book_service |
| information_schema   |
| mysql                |
| payroll_service      |
| performance_schema   |
| sys                  |
+----------------------+
6 rows in set (0.15 sec)

mysql> use payroll_service;
Database changed

--------------------------------------------------------------------------------
UC2 -> Created table employee_payroll into payroll_service database
--------------------------------------------------------------------------------

mysql> create table employee_payroll
    -> (
    -> id int unsigned NOT NULL AUTO_INCREMENT,
    -> name varchar(160) NOT NULL,
    -> salary double NOT NULL,
    -> start date NOT NULL,
    -> Primary key(id)
    -> );
Query OK, 0 rows affected (0.60 sec)

mysql> describe employee_payroll;
+--------+--------------+------+-----+---------+----------------+
| Field  | Type         | Null | Key | Default | Extra          |
+--------+--------------+------+-----+---------+----------------+
| id     | int unsigned | NO   | PRI | NULL    | auto_increment |
| name   | varchar(160) | NO   |     | NULL    |                |
| salary | double       | NO   |     | NULL    |                |
| start  | date         | NO   |     | NULL    |                |
+--------+--------------+------+-----+---------+----------------+
4 rows in set (0.10 sec)

-----------------------------------------------------------------------------------
UC3 -> Inserted employee data in table employee_payroll of payroll_service database
------------------------------------------------------------------------------------

mysql> Insert into employee_payroll(name,salary,start)values
    -> ('Annu',10000.0,'2018-01-03'),
    -> ('Choti',50000.0,'2019-11-13'),
    -> ('Mannu',40000.0,'2020-05-21');
Query OK, 3 rows affected (0.52 sec)
Records: 3  Duplicates: 0  Warnings: 0

------------------------------------------------------------------------------------------
UC4 -> Retrieved all employee data from table employee_payroll of payroll_service database
-------------------------------------------------------------------------------------------

mysql> select * from employee_payroll;
+----+-------+--------+------------+
| id | name  | salary | start      |
+----+-------+--------+------------+
|  1 | Annu  |  10000 | 2018-01-03 |
|  2 | Choti |  50000 | 2019-11-13 |
|  3 | Mannu |  40000 | 2020-05-21 |
+----+-------+--------+------------+
3 rows in set (0.03 sec)

--------------------------------------------------------------
UC5 -> Ability to retrieve salary data for particular employee
---------------------------------------------------------------

mysql> select salary from employee_payroll where name = 'Annu';
+--------+
| salary |
+--------+
|  10000 |
+--------+
1 row in set (0.53 sec)

mysql> select * from employee_payroll where start between cast('2018-01-01' as date) and date (now());
+----+-------+--------+------------+
| id | name  | salary | start      |
+----+-------+--------+------------+
|  1 | Annu  |  10000 | 2018-01-03 |
|  2 | Choti |  50000 | 2019-11-13 |
|  3 | Mannu |  40000 | 2020-05-21 |
+----+-------+--------+------------+
3 rows in set (0.03 sec)

---------------------------------------------------------------------------------------
UC6 -> Added gender field into table and updated the table according to employee gender
---------------------------------------------------------------------------------------

mysql> alter table employee_payroll add gender char(1) after name;
Query OK, 0 rows affected (0.83 sec)
Records: 0  Duplicates: 0  Warnings: 0

mysql> describe employee_payroll;
+--------+--------------+------+-----+---------+----------------+
| Field  | Type         | Null | Key | Default | Extra          |
+--------+--------------+------+-----+---------+----------------+
| id     | int unsigned | NO   | PRI | NULL    | auto_increment |
| name   | varchar(160) | NO   |     | NULL    |                |
| gender | char(1)      | YES  |     | NULL    |                |
| salary | double       | NO   |     | NULL    |                |
| start  | date         | NO   |     | NULL    |                |
+--------+--------------+------+-----+---------+----------------+
5 rows in set (0.12 sec)

mysql> update employee_payroll set gender ='F' where name ='Annu' or name='Choti';
Query OK, 2 rows affected (0.04 sec)
Rows matched: 2  Changed: 2  Warnings: 0

mysql> update employee_payroll set gender ='M' where name ='Mannu';
Query OK, 1 row affected (0.01 sec)
Rows matched: 1  Changed: 1  Warnings: 0

mysql> select * from employee_payroll;
+----+-------+--------+--------+------------+
| id | name  | gender | salary | start      |
+----+-------+--------+--------+------------+
|  1 | Annu  | F      |  10000 | 2018-01-03 |
|  2 | Choti | F      |  50000 | 2019-11-13 |
|  3 | Mannu | M      |  40000 | 2020-05-21 |
+----+-------+--------+--------+------------+
3 rows in set (0.00 sec)

--------------------------------------------------------------------------------
UC7 -> Found sum, average, min, max and number of male and female employees
--------------------------------------------------------------------------------

mysql> select sum(salary) from employee_payroll where gender ='F' group by gender;
+-------------+
| sum(salary) |
+-------------+
|       60000 |
+-------------+
1 row in set (0.02 sec)

mysql> select sum(salary) from employee_payroll where gender ='M' group by gender;
+-------------+
| sum(salary) |
+-------------+
|       40000 |
+-------------+
1 row in set (0.00 sec)

mysql> select avg(salary) from employee_payroll where gender ='F' group by gender;
+-------------+
| avg(salary) |
+-------------+
|       30000 |
+-------------+
1 row in set (0.00 sec)

mysql> select avg(salary) from employee_payroll where gender ='M' group by gender;
+-------------+
| avg(salary) |
+-------------+
|       40000 |
+-------------+
1 row in set (0.00 sec)

mysql> select min(salary) from employee_payroll where gender ='F' group by gender;
+-------------+
| min(salary) |
+-------------+
|       10000 |
+-------------+
1 row in set (0.00 sec)

mysql> select min(salary) from employee_payroll where gender ='M' group by gender;
+-------------+
| min(salary) |
+-------------+
|       40000 |
+-------------+
1 row in set (0.00 sec)

mysql> select max(salary) from employee_payroll where gender ='F' group by gender;
+-------------+
| max(salary) |
+-------------+
|       50000 |
+-------------+
1 row in set (0.00 sec)

mysql> select max(salary) from employee_payroll where gender ='M' group by gender;
+-------------+
| max(salary) |
+-------------+
|       40000 |
+-------------+
1 row in set (0.00 sec)

mysql> select gender,avg(salary) from employee_payroll group by gender;
+--------+-------------+
| gender | avg(salary) |
+--------+-------------+
| F      |       30000 |
| M      |       40000 |
+--------+-------------+
2 rows in set (0.01 sec)

mysql> select gender,count(name) from employee_payroll group by gender;
+--------+-------------+
| gender | count(name) |
+--------+-------------+
| F      |           2 |
| M      |           1 |
+--------+-------------+
2 rows in set (0.00 sec)

--------------------------------------------------------------------------------------------------------------------------
UC8 -> Ability to extend employee_payroll data to store employee information like employee phone, address and department
--------------------------------------------------------------------------------------------------------------------------

mysql> describe employee_payroll;
+--------+--------------+------+-----+---------+----------------+
| Field  | Type         | Null | Key | Default | Extra          |
+--------+--------------+------+-----+---------+----------------+
| id     | int unsigned | NO   | PRI | NULL    | auto_increment |
| name   | varchar(160) | NO   |     | NULL    |                |
| gender | char(1)      | YES  |     | NULL    |                |
| salary | double       | NO   |     | NULL    |                |
| start  | date         | NO   |     | NULL    |                |
+--------+--------------+------+-----+---------+----------------+
5 rows in set (0.20 sec)

mysql> alter table employee_payroll add phoneNumber varchar(230) after name;
Query OK, 0 rows affected (0.59 sec)
Records: 0  Duplicates: 0  Warnings: 0

mysql> alter table employee_payroll add address varchar(250) after PhoneNumber;
Query OK, 0 rows affected (0.06 sec)
Records: 0  Duplicates: 0  Warnings: 0

mysql> alter table employee_payroll add department varchar(250) not null after address;
Query OK, 0 rows affected (0.08 sec)
Records: 0  Duplicates: 0  Warnings: 0

mysql> alter table employee_payroll alter address set default 'TBD';
Query OK, 0 rows affected (0.02 sec)
Records: 0  Duplicates: 0  Warnings: 0

mysql> describe employee_payroll;
+-------------+--------------+------+-----+---------+----------------+
| Field       | Type         | Null | Key | Default | Extra          |
+-------------+--------------+------+-----+---------+----------------+
| id          | int unsigned | NO   | PRI | NULL    | auto_increment |
| name        | varchar(160) | NO   |     | NULL    |                |
| phoneNumber | varchar(230) | YES  |     | NULL    |                |
| address     | varchar(250) | YES  |     | TBD     |                |
| department  | varchar(250) | NO   |     | NULL    |                |
| gender      | char(1)      | YES  |     | NULL    |                |
| salary      | double       | NO   |     | NULL    |                |
| start       | date         | NO   |     | NULL    |                |
+-------------+--------------+------+-----+---------+----------------+
8 rows in set (0.00 sec)

mysql> update  employee_payroll set address=default;
Query OK, 3 rows affected (0.02 sec)
Rows matched: 3  Changed: 3  Warnings: 0

mysql> select * from employee_payroll;
+----+-------+-------------+---------+------------+--------+--------+------------+
| id | name  | phoneNumber | address | department | gender | salary | start      |
+----+-------+-------------+---------+------------+--------+--------+------------+
|  1 | Annu  | NULL        | TBD     |            | F      |  10000 | 2018-01-03 |
|  2 | Choti | NULL        | TBD     |            | F      |  50000 | 2019-11-13 |
|  3 | Mannu | NULL        | TBD     |            | M      |  40000 | 2020-05-21 |
+----+-------+-------------+---------+------------+--------+--------+------------+
3 rows in set (0.00 sec)

------------------------------------------------------------------------------------------------------------------------
UC9 -> Ability to extend employee_payroll table to have Basic Pay,Deductions, Taxable Pay, Income Tax, Net Pay
------------------------------------------------------------------------------------------------------------------------

mysql> alter table employee_payroll  rename column salary to basic_pay;
Query OK, 0 rows affected (0.23 sec)
Records: 0  Duplicates: 0  Warnings: 0

mysql> alter table employee_payroll  add deduction double not null after basic_pay;
Query OK, 0 rows affected (0.04 sec)
Records: 0  Duplicates: 0  Warnings: 0

mysql> alter table employee_payroll  add taxable_pay double not null after deduction;
Query OK, 0 rows affected (0.04 sec)
Records: 0  Duplicates: 0  Warnings: 0

mysql> alter table employee_payroll  add income_tax double not null after taxable_pay;
Query OK, 0 rows affected (0.03 sec)
Records: 0  Duplicates: 0  Warnings: 0

mysql> alter table employee_payroll  add net_pay double not null after income_tax;
Query OK, 0 rows affected (0.04 sec)
Records: 0  Duplicates: 0  Warnings: 0

mysql> describe employee_payroll;
+-------------+--------------+------+-----+---------+----------------+
| Field       | Type         | Null | Key | Default | Extra          |
+-------------+--------------+------+-----+---------+----------------+
| id          | int unsigned | NO   | PRI | NULL    | auto_increment |
| name        | varchar(160) | NO   |     | NULL    |                |
| phoneNumber | varchar(230) | YES  |     | NULL    |                |
| address     | varchar(250) | YES  |     | TBD     |                |
| department  | varchar(250) | NO   |     | NULL    |                |
| gender      | char(1)      | YES  |     | NULL    |                |
| basic_pay   | double       | NO   |     | NULL    |                |
| deduction   | double       | NO   |     | NULL    |                |
| taxable_pay | double       | NO   |     | NULL    |                |
| income_tax  | double       | NO   |     | NULL    |                |
| net_pay     | double       | NO   |     | NULL    |                |
| start       | date         | NO   |     | NULL    |                |
+-------------+--------------+------+-----+---------+----------------+
12 rows in set (0.00 sec)



